,company_brand,founded,headquarter,sector,about_company,founders,investor,amount,stage,year,founder Count,num_founders,FounderCategory
680,Plutomen,2016,Ahmedabad,Entertainment,Plutomen Technologies Pvt Ltd founded in Nov 2016 is recognized start-up by DIPP in the field of Emerging Technology.,Keyur Bhalavat,GUSEC Seed Fund,300000.0,others,2021,1,1,Multiple Founders
681,GoMechanic,2016,Gurgaon,Transportation,"GoMechanic is India’s leading multi-brand car service company, committed to making the car servicing experience hassle-free & easy for everyone.",Kushal Karwa,Tiger Global,42000000.0,early traction,2021,1,1,Multiple Founders
682,Grinntech,2013,Chennai,Transportation,"Grinntech is an investor backed, growth phase start-up, leading on all front of battery design for EV applications.","Nikhilesh Mishra, Puneet Jain",None,2000000.0,others,2021,2,2,Multiple Founders
683,Nobel Hygiene,1999,Mumbai,HealthTech,"Nobel Hygiene is one of the leading disposable hygiene care products manufacturer in the country with an ISO 9001:2015 and CE certification, headquartered in Mumbai.",Johari Kamal,Quadria Capital,60000000.0,others,2021,1,1,Multiple Founders
684,Green Cure,2015,Delhi,HealthTech,World's first company to combine German Engineering with Indian Ayurveda in health products,Sanchit Garg,Venture Catalysts,3000000.0,early traction,2021,1,1,Multiple Founders
685,Classplus,2017,Noida,Education,Classplus was born out of an urge to redefine classroom engagement in this country.,"Mukul Rustagi, Bhaswat Agarwal",Tiger Global,65000000.0,early traction,2021,2,2,Multiple Founders
686,WINDO,2020,Hyderabad,E-Commerce,Convert Instagram Page Into an Online Store in under 2-minutes. Create a free online store and automate your sales.,"Silus Reddy Chintapalli, Rakesh Vaddadi",Unicorn India Ventures,500000.0,validation,2021,2,2,Multiple Founders
687,ApnaKlub,2020,Bangalore,E-Commerce,Supporting independent businesses and retail entrepreneurs with better than market wholesale prices and supply chain.,"Shruti, Manish Kumar",Blume Ventures,3000000.0,early traction,2021,2,2,Multiple Founders
688,LegalPay,2019,Delhi,Financial Services,A tech focused B2B litigation finance company in India.,Kundan Shahi,Ashwini Kakkar. 9Unicorns,3000000.0,others,2021,1,1,Multiple Founders
689,Lavado,2016,Mumbai,Service industry,A startup that is trying to permanently change the way people approach the cleaning and maintenance of their apparel and accessories.,Disha Jain,Ashish Shah,3000000.0,others,2021,1,1,Multiple Founders
690,Navars,2019,Hyderabad,Education,"Navars Edutech comprises dynamic mix of intellectual professionals, managerial team, Subject matter experts and Astronomy and Space researchers.",Sravan Varma Datla,aad Network,3000000.0,others,2021,1,1,Multiple Founders
691,GoBolt,2015,Gurgaon,Logistics,"GoBOLT is a tech-logistics company operating in Line Haul & Short Haul Trucking, creating value through dis-intermediation, increased asset utilization and extensive use of technology.","Naitik Baghla, Parag Aggarwal, Sumit Sharma",Paragon Partners,20000000.0,early traction,2021,3,3,Multiple Founders
692,Loco,2018,Bangalore,Entertainment,Loco is India's leading live game streaming app.,"Anirudh Pandita, Ashwin Suresh",Krafton,9000000.0,validation,2021,2,2,Multiple Founders
693,Auric,2017,Delhi,HealthTech,Contemporary Beauty & Wellness Brand Based on Ayurveda,Deepak Agarwal,Venture Catalysts,2000000.0,early traction,2021,1,1,Multiple Founders
694,Edmingle,2016,Bangalore,Education,Edmingle is a platform for all educators who want to launch their courses and sell them online.,Gaurav Doshi,Indovation Fund,300000.0,others,2021,1,1,Multiple Founders
695,Slice,2016,Bangalore,Financial Services,"Slice is India's best credit card challenger to pay bills, manage expenses, and unlock rewards.",ajan Bajaj,Gunosy,20000000.0,others,2021,1,1,Multiple Founders
696,Humit,2020,Bangalore,Entertainment,Humit is a social networking app for music sharing and discovery.,"ohit Ganapathy, Prithvi Sankar, Ishaan Negi",Antler India,3000000.0,validation,2021,3,3,Multiple Founders
697,Airblack,2019,Gurgaon,InfoTech & Services,Airblack is on a mission to help people convert their passion to a livelihood.,"Videt Jaiswal, Vaibhav Raj Gupta",dge Ventures,5200000.0,early traction,2021,2,2,Multiple Founders
698,NIRAMAI,2016,Bangalore,HealthTech,"NIRAMAI has developed a novel breast cancer screening solution that uses Thermalytix, i.e. machine intelligence over thermography images.",Geetha Manjunath,CDC Group,3000000.0,others,2021,1,1,Multiple Founders
699,Intervue,2021,Delhi,AI,World's fastest collaborative environment to take tech interviews.,"ahul Arora, Pushpender Singh Rautela",Titan Capital,3000000.0,validation,2021,2,2,Multiple Founders
700,Nestroots,2016,Gurgaon,Fashion and lifestyle,"Ottoman, Stool, Brass Kitchen Solutions, Masala Box, Roti Box, Bar Accessories and Many Gifting Options at Nestroots.",Chhavi Singh,We Founder Circle,100000.0,validation,2021,1,1,Multiple Founders
701,Detect Technologies,2016,Chennai,Transportation,Detect Technologies is a leading Industrial AI company that is building innovative solutions and cutting-edge technology for the industrial ecosystem.,Daniel Raj David,Accel Partners,12000000.0,others,2021,1,1,Multiple Founders
702,CredR,2015,Bangalore,Transportation,CredR is India’s Most Trusted Used Two-Wheeler Consumer Brand that leverages Technology & Processes to simplify the Used Two-wheeler Market.,Sasidhar Nandigam,Yamaha Motors,6500000.0,others,2021,1,1,Multiple Founders
703,Fourth Partner Energy,2010,Hyderabad,Solar,"Fourth Partner Energy is India’s leading distributed solar energy firm focusing on building and financing solar projects across the private and public sectors for commercial, industrial and institutional entities.",Vivek Subramanian,Norfund,125000000.0,others,2021,1,1,Multiple Founders
704,TABLT,2018,Kolkata,HealthTech,TABLT [Previously Sabse Sasta Dukaan] is one of India's most trusted online pharmacy dealing in medicines and other healthcare products.,Anish Agarwal,Siti Cable,3000000.0,others,2021,1,1,Multiple Founders
705,Hesa,2020,Hyderabad,InfoTech & Services,HESA is connecting Bharat with India and India with Bharat Phygitally. We are bridging the gap for the world’s largest customer base that resides in rural India.,"Vamsi Udayagiri, Hema Nandiraju",Venture Catalysts,2000000.0,validation,2021,2,2,Multiple Founders
706,Powerhouse91,2020,Gurgaon,Consumer Goods,"A tech-driven company that acquires, operates, and scales outstanding ecommerce brands in India.","Shashwat Diesh, Aqib Mohammed",Crossbeam Venture Partners,3000000.0,validation,2021,2,2,Multiple Founders
707,Nalanda Learning,2011,Kolkata,Education,India's 1st Online Preschool with Blended Learning Model,Tamal Mukherjee,Aavishkaar Capital,5000000.0,others,2021,1,1,Multiple Founders
708,Chargeup,2019,Delhi,Renewable Energy,"""Battery as a Service"" for 3 wheeler & 2 wheelers","Varun Goenka, Akshay Kashyap",Mapmyindia,3000000.0,early traction,2021,2,2,Multiple Founders
709,Knackit,2019,Bangalore,InfoTech & Services,Knackit is a talent sharing platform where users can showcase and monetize their artistry.,"Pranjal Kumar, Akanksha Bhardwaj",Jyoti Bansal,100000.0,others,2021,2,2,Multiple Founders
710,Treebo Hotels,2015,Bangalore,Hospitality,Treebo Hotels is India's most loved hotel chain in the premium-budget segment.,"Sidharth Gupta, Kadam Jeet Jain, Rahul Chaudhary",Accor,16000000.0,early traction,2021,3,3,Multiple Founders
711,Raptee Energy,2019,Chennai,Transportation,Raptee Energy Inc. is looking to accelerate the transition to smart and sustainable mobility!,Phunith Kumar,None,700000.0,others,2021,1,1,Multiple Founders
712,Meddo,2018,Gurgaon,HealthTech,Meddo (Arctern Healthcare) are re-defining how primary and secondary healthcare is provided in India through a connected care delivery platform.,"Saurabh Kochhar, Dr Naveen Nishchal",SRI Capital,6000000.0,others,2021,2,2,Multiple Founders
713,Supertails,2021,Bangalore,Service industry,Supertails is building a digital pet care platform which offers expert led healthcare services and products.,"Vineet Khanna, Varun Sadana, Aman Tekriwal",Saama Capital,2600000.0,early traction,2021,3,3,Multiple Founders
714,SkilloVilla,2020,Bangalore,Education,Mission to support young graduates in enhancing their learnings and transform them into big earnings.,"onak Agrawal, Rajat Agrawal, Deepak Kharol",Titan Capital,300000.0,validation,2021,3,3,Multiple Founders
715,Cancer Clinics,2014,Telangana,HealthTech,"Cancer Helpline is a source of information and support, helping with all the things that people affected by cancer want and need.","Sonali Srungaram, Sasi Sunkara",Axilor,1500000.0,early traction,2021,2,2,Multiple Founders
716,Velocity,2020,Bangalore,Financial Services,Velocity provides revenue-based-financing to online businesses. It aims to build the future of banking and financial services for new age businesses in India.,"Abhiroop Medhekar, Atul Khichariya, Saurav Swaroop",Valar Ventures,1300000.0,validation,2021,3,3,Multiple Founders
717,Happy Jars,2016,Delhi,Food Industry,"Manufacture and retail a delicious range of all-natural nut butters, made without oil, sugar or preservatives.","Surabhi Talwar, Vikram Sekhar",Inflection Point Ventures,400000.0,validation,2021,2,2,Multiple Founders
718,Inshorts,2013,Noida,Media,Inshorts is a news aggregator application that collects and summarizes news based on user behavior and preferences.,"Anunay Pandey, Azhar Iqubal, Deepit Purkayastha",Addition,40000000.0,others,2021,3,3,Multiple Founders
719,ExtraaEdge,2015,Pune,Marketing,Data Science powered - Admission & Marketing CRM Automation for Education Enrolments,"Abhishek Ballabh, Sushil Mundada",9Unicorns Accelerator Fund,1000000.0,early traction,2021,2,2,Multiple Founders
720,Zotalabs,2019,Pune,Tech Startup,Zotalabs gives the power of Emerging Technology to your digital automation with our easy to use APIs.,"Nausherwan Shah, Wasim Khan",Alfa Ventures,1250000.0,validation,2021,2,2,Multiple Founders
721,Voiro,2014,Bangalore,Marketing,Voiro is the first all-in-one revenue management suite exclusively for ad-led digital publishers across media.,"Anand Gopal, Kavita Shenoy",1Crowd,1800000.0,early traction,2021,2,2,Multiple Founders
722,Dream Sports,2008,Mumbai,Entertainment,"Dream Sports is India’s leading sports technology company with brands such as Dream11, FanCode, DreamX and DreamSetGo in its portfolio.","Bhavit Sheth, Harsh Jain",TCV,400000000.0,others,2021,2,2,Multiple Founders
723,Safex Chemicals,1991,Delhi,AgriTech,Safex Chemicals India Ltd is a leading company having a strong foothold in the Indian agrochemicals industry.,"SK Jindal, SK Chaudhary",BanyanTree FiNonece Pvt. Ltd.,50000000.0,others,2021,2,2,Multiple Founders
724,Instoried,2018,Bangalore,Marketing,Instoried is an augmented writing platform which improves customer interest and engagement.,"Sharmin Ali, Sutanshu Raj",XPERT DOJO,3000000.0,others,2021,2,2,Multiple Founders
725,Rupifi,2019,Bangalore,Financial Services,Rupifi operates a software-as-a-service (SaaS) firm focussed on financial products.,Anubhav Jain,Quona Capital,4100000.0,early traction,2021,1,1,Multiple Founders
726,Moneyboxx,1994,Mumbai,Financial Services,Moneyboxx Finance provides easy access to financing to the deserving micro enterprises.,Deepak Aggarwal,Ashv FiNonece,3000000.0,others,2021,1,1,Multiple Founders
727,CityMall,2019,Gurgaon,E-Commerce,CityMall is a social e-commerce platform that sells lifestyle and curated products via peer-to-peer referrals on WhatsApp.,"Angad Kikla, Divij Goyal",WaterBridge Ventures,11000000.0,early traction,2021,2,2,Multiple Founders
728,Janani,2020,Bangalore,HealthTech,Janani.ai is a fertility care provider.,Nilay Mehrotra,Sweta Rau,1000000.0,validation,2021,1,1,Multiple Founders
729,ReshaMandi,2020,Bangalore,AgriTech,India's 1st award winning technology led digital ecosystem for Silk,Utkarsh Apoorva,Omnivore,1700000.0,validation,2021,1,1,Multiple Founders
730,Bombay Shaving Company,2015,Delhi,Fashion and lifestyle,"Bombay Shaving Company is a consumer goods company that focuses on developing a range of shave care, beard care, and skincare products.","Deepu Panicker, Raunak Munot, Rohit Jaiswal, Shantanu Deshpande",ajesh Sud,2000000.0,others,2021,4,4,Multiple Founders
731,DotPe,2019,Gurgaon,Financial Services,DotPe is a technology start-up providing a commerce and payments platform to offline enterprise businesses.,"Anurag Gupta, Gyanesh Sharma, Shailaz Nag",PayU,27000000.0,early traction,2021,3,3,Multiple Founders
732,Homingos,2018,Bangalore,AI,Homingos is an Augmented reality (AR)-based social networking platform.,"Shourya Agarwal, Malhar Patil, Rajat Gupta",Sundi Natarajan,3000000.0,others,2021,3,3,Multiple Founders
733,Anar Business Community,2020,Mumbai,Tech Startup,Anar is a communications and networking platform for businesses around the world.,"Nishank Jain, Sanjay Bhat",Titan Capital,3000000.0,others,2021,2,2,Multiple Founders
734,Five Star Finance,1984,Chennai,Financial Services,Five-Star is a Registered Non Banking Finance Company (NBFC) with Reserve Bank of India (RBI).,V K Ranganathan,TPG Capital Asia,234000000.0,others,2021,1,1,Multiple Founders
735,Settlrs,2018,Bangalore,Real Estate,"A B2B rental services company for furniture, home appliances, electronic and IT infrastructure.","Gaurav Ranebennur, Nishanth Janadri",MaGEHold Pte. Ltd.,3000000.0,early traction,2021,2,2,Multiple Founders
736,BYJU'S,2011,Bangalore,Education,BYJU'S is an educational technology company that develops personalized learning programs for K-12 students.,"Byju Raveendran, Divya Gokulnath",BlackRock,460000000.0,early traction,2021,2,2,Multiple Founders
737,Annapurna Finance,2009,Bhubaneswar,Financial Services,Annapurna Microfinance is a microfinance venture that works for the financial and economic upliftment of underserved and unreached women.,Gobinda Chandra Pattnaik,Asian Development Bank,30000000.0,others,2021,1,1,Multiple Founders
738,HealthPlix,2014,Bangalore,HealthTech,HealthPlix is a healthtech startup,"aghuraj Sunder Raju, Sandeep Gudibanda",JSW Ventures,13500000.0,early traction,2021,2,2,Multiple Founders
739,Masai School,2019,Bangalore,Education,Masai School is a job-oriented software training services.,Prateek Shukla,Unitus Ventures,5000000.0,early traction,2021,1,1,Multiple Founders
740,Bewakoof,2011,Mumbai,Service industry,"Society perceives Bewakoof as stupid.But what does society call Bewakoof?Often, it’s anything different or anything that’s done differently.",Prabhkiran Singh,IvyCap Ventures,4000000.0,others,2021,1,1,Multiple Founders
741,IndiaLends,2014,Delhi,Financial Services,IndiaLends is a digital lending and borrowing marketplace.,"Gaurav Chopra, Mayank Kachhwaha",ACPI Investments,5100000.0,others,2021,2,2,Multiple Founders
742,Stelis Biopharma,2007,Bangalore,HealthTech,Stelis Biopharma is a vertically integrated biopharmaceutical company.,Pudhucode Radhakrishnan Kannan,outeOne,195000000.0,early traction,2021,1,1,Multiple Founders
743,Tilt,2016,Bangalore,Service industry,A bike-share for Indian campuses,Deepak VS,Y Combinator,125000.0,others,2021,1,1,Multiple Founders
744,NeoDove,2020,Jaipur,AI,"Neodove is an AI-powered, end to end tech-enabled customer communication and reporting solution.",Aprit Khandelwal,India Quotient,15000000.0,validation,2021,1,1,Multiple Founders
745,Zaara Biotech,2016,Kottayam,HealthTech,India's First Algal-seaweed Biotechnology Students' Startup in collaboration with ICAR- Central Institute of fisheries and Technology,Najeeb Bin Haneef,TCN International Commerce,10000000.0,others,2021,1,1,Multiple Founders
746,KreditBee,2018,Bangalore,Financial Services,KreditBee is a digital lending platform developed to assist young professionals with their personal finances.,"Karthikeyan Krishnaswamy, Madhusudan Ekambaram, Wan Hong",Alpine Capital,75000000.0,validation,2021,3,3,Multiple Founders
747,True Balance,2014,Gurgaon,Financial Services,True Balance is a digital wallet that enables users to access utility bill payment and other financial products.,"Cheolwon Lee, Jay Yi, Martin Lee",Bon Angels Venture Partners,10000000.0,others,2021,3,3,Multiple Founders
748,Muvin,2020,Bangalore,Financial Services,Youth Neobank enabling financial solutions for the teenagers and young people,Mukund V Rao,None,1000000.0,validation,2021,1,1,Multiple Founders
749,Purplle,2011,Mumbai,Fashion and lifestyle,"Purplle is an online store selling cosmetics, fragrances, skin, and hair care products.","Manish Taneja, Rahul Dash",Spring Marketing Capital,45000000.0,others,2021,2,2,Multiple Founders
750,FloBiz,2019,Bangalore,Tech Startup,India’s first neobusiness platform,ahul Raj,levation Capital,10000000.0,early traction,2021,1,1,Multiple Founders
751,Jeevam Health,2020,Delhi,HealthTech,Jeevam Health is an Online Medical Clinic to Cure Root Cause of Chronic Issues in India.,"Kamran alam, Piyush vishwakarma",Y Combinator,1500000.0,validation,2021,2,2,Multiple Founders
752,NewLink Group,2016,Beijing,Tech Startup,Developer of an energy management and transportation digital platform designed to streamline the energy supply chain,"Yang Wang, Zhen Dai",Bain Capital,200000000.0,others,2021,2,2,Multiple Founders
753,OZiva,2016,Mumbai,HealthTech,OZiva is a plant-based Clean Nutrition Brand.,"Aarti, Mihir Gadani",-Prime Capital,12000000.0,early traction,2021,2,2,Multiple Founders
754,Blive,2004,Panaji,Tourism,B: Live is an electric vehicle tourism startup.,"Samarth Kholkar, Sandeep Mukherjee",Mumbai Angels,1000000.0,early traction,2021,2,2,Multiple Founders
755,Nazara Technologies,2000,Mumbai,Entertainment,"Nazara Technologies develops mobile content such as games, themes, wallpapers, and multimedia.",Nitish Mittersain,Hornbill Capital Advisers,30000000.0,others,2021,1,1,Multiple Founders
756,Euler Motors,2018,Delhi,Transportation,Electric Light Commercial Vehicle,Saurav Kumar,ADB Ventures,2600000.0,early traction,2021,1,1,Multiple Founders
757,Pixxel,2019,Bangalore,SpaceTech,Pixxel is a Bengaluru-based space technology startup building a constellation of advanced earth imaging small satellites.,"Awais Ahmed, Kshitij Khandelwal",Techstars,7300000.0,validation,2021,2,2,Multiple Founders
758,Prescinto,2016,Gujarat,Solar,Prescinto is the brain of a solar plant delivering Actionable Intelligence to Increase Generation.,Puneet Jaggi,Venture Catalysts,3500000.0,validation,2021,1,1,Multiple Founders
759,MyGlamm,2015,Mumbai,Fashion and lifestyle,MyGlamm is a direct-to-consumer brand of award winning European beauty products.,Darpan Sanghvi,Bessemer Venture Partners,20000000.0,early traction,2021,1,1,Multiple Founders
760,Chirrup,2020,Bangalore,Entertainment,Video integrated social-gaming platform,"Vipul Garg, Sourav Lashkari, Mehul Mittal",Titan Capital,300000.0,validation,2021,3,3,Multiple Founders
761,Policybazaar,2008,Gurgaon,Financial Services,PolicyBazaar designs an online life insurance and general insurance comparison portal that analyzes financial products.,"Alok Bansal, Avaneesh Nirjar, Manoj Sharma, Tarun Mathur, Yashish Dahiya",alcon Edge Capital,75000000.0,others,2021,5,5,Multiple Founders
762,Livve Homes,2017,Bangalore,Real Estate,"India's homegrown online portal, championing the region for a brighter, more exciting livvable future. Right from simply connecting owners and tenants and to managing everything in between",Maya Lakshman,Angel investors,5000000.0,others,2021,1,1,Multiple Founders
763,Juicy Chemistry,2014,Coimbatore,HealthTech,Juicy Chemistry operates as an eponymous consumer brand.,"Megha, Pritesh Asher.",Akya Ventures,6300000.0,early traction,2021,2,2,Multiple Founders
764,Svasti Microfinance,2008,Mumbai,Financial Services,Svasti works with urban slum dwellers women microentrepreneurs.,"Arunkumar Padmanabhan, Narayanan Subramaniam",Kayenne Ventures,4000000.0,others,2021,2,2,Multiple Founders
765,Nexprt,2020,Delhi,Service industry,Nexprt Solutions offers end-to-end and 100% customized import solutions.,Harsha Vardhan K,Titan Capital,2000000.0,others,2021,1,1,Multiple Founders
766,Wysa,2015,Bangalore,AI,Wysa is an AI conversational agent that has been shown to help improve mental health,"Jo Aggarwal, Ramakant Vempati",Kae Capital,3000000.0,others,2021,2,2,Multiple Founders
767,Ankur capital,2011,Mumbai,Financial Services,Early stage venture capital fund focused on opportunities created by rising aspirations & digital access for next billion Indians.,itu Verma,None,40000000.0,others,2021,1,1,Multiple Founders
768,Indifi,2015,Gurgaon,Financial Services,Indifi Technologies is a digital lending platform that offers loans to those that have potential and intent.,"Alok Mittal, Siddharth Mahanot, Sundeep Sahi",levar Equity,5000000.0,others,2021,3,3,Multiple Founders
769,Firmway,2016,Mumbai,Financial Services,Firmway is a platform that digitizes balance confirmation and reconciliation process.,"Prashant Gupta, Vivek Chandan",None,3000000.0,validation,2021,2,2,Multiple Founders
770,Say Cheese,2020,Mumbai,HealthTech,"Say Cheese is the first holistic women-happiness platform in India, focused to increase the happiness of women through personalized solutions",ajpreet Kaur,None,1000000.0,validation,2021,1,1,Multiple Founders
771,Indic Inspirations,2019,Pune,Cultural,"Indian Souvenirs online that reflect Indian tradition, culture & stories. Best for personal gifting and corporate gifting.",Sunil Jalihal,Marquee investors,300000.0,others,2021,1,1,Multiple Founders
772,Bimaplan,2020,Mumbai,Financial Services,Affordable insurance for the next billion Indians,Vikul Goyal,Titan Capital,500000.0,validation,2021,1,1,Multiple Founders
773,YAP,2014,Chennai,Financial Services,YAP is the API Platform for Banking and Payments products in Asia. More than 200 Fintechs across Asia rely on YAP,"Madhusudanan R, Prabhu ",Jitendra Gupta,10000000.0,early traction,2021,2,2,Multiple Founders
774,Leap Finance,2019,Bangalore,Financial Services,Leap Finance is a fintech startup for Indian students pursuing international higher education,Vaibhav Singh,Jungle Ventures,17000000.0,early traction,2021,1,1,Multiple Founders
775,BlackSoil NBFC,2010,Mumbai,Financial Services,BlackSoil Capital has transformed into an alternative NBFC and AIF Fund platform with an expertise to finance multiple sectors.,Mohinder Pal Bansal,None,3000000.0,others,2021,1,1,Multiple Founders
776,OYO,2012,Gurgaon,Hospitality,OYO operates a branded network of hotels designed to offer standardized stay experiences.,itesh Agarwal,Hindustan Media Venture,200000000.0,others,2021,1,1,Multiple Founders
777,Max Healthcare,2000,Delhi,HealthTech,Max Healthcare is one of the leading chain of hospitals in India.,Analjit Singh,adiant Life Care Private Ltd,140000000.0,others,2021,1,1,Multiple Founders
778,4baseCare,2018,Bangalore,HealthTech,4baseCare develops a unified and patient-centric ecosystem to fight cancer.,"Hitesh Goswami, Kshitij Rishi",Mount Judi Ventures,2000000.0,early traction,2021,2,2,Multiple Founders
779,Ezstays,2019,Delhi,Education,"Ezstays is a leading student-life network, providing hostels and PG accommodation with top-tier living facilities at the best prices.","Vaibhav Khanna, Abhishek Kumar, Kumar Gaurav",ichard Rekhy,400000.0,validation,2021,3,3,Multiple Founders
780,Stylework,2017,Gurgaon,others,Stylework is an unconventional co-working space aggregator that is going to change the way people work.,Sparsh Khandelwal,Inflection Point Ventures,500000.0,early traction,2021,1,1,Multiple Founders
781,Kinara Capital,2011,Bangalore,Financial Services,Kinara Capital is a financing company that provides flexible collateral-free loans to small business entrepreneurs.,Hardika Shah,GAWA Capital,6000000.0,others,2021,1,1,Multiple Founders
782,Riskcovry,2018,Bangalore,Financial Services,"Riskcovry is an ""Insurance-in-a-box” model offers a one-stop-shop platform to cater to any business's digital insurance needs.","Suvendu Prusty, Sorabh Bhandari, Vidya Sridharan, Chiranth Patil",Better Capital,5000000.0,early traction,2021,4,4,Multiple Founders
783,NODWIN,2012,Gurgaon,Entertainment,NODWIN Gaming is a gaming solutions company and creator of e-sports events.,Gautam Virk,Krafton,20000000.0,others,2021,1,1,Multiple Founders
784,Quizizz,2015,Bangalore,Education,Quizizz is a Education based startup,"Ankit Gupta, Deepak Joy Cheenath",ight Roads Ventures India,12500000.0,early traction,2021,2,2,Multiple Founders
785,Ecom Express,2012,Delhi,E-Commerce,Ecom Express is an end-to-end technology-enabled logistics solutions provider to the Indian e-commerce industry.,"K. Satyanarayana, Manju Dhawan, Sanjeev Saxena, T. A. Krishnan",CDC Group,20000000.0,others,2021,4,4,Multiple Founders
786,Turtlemint,2015,Mumbai,Financial Services,Turtlemint is an online insurance platform that identifies and purchases appropriate insurance policies for consumers.,"Anand Prabhudesai, Dhirendra Mahyavanshi, Kunal Shah",Jungle Ventures,45000000.0,early traction,2021,3,3,Multiple Founders
787,Captain Fresh,2019,Bangalore,Logistics,Captain Fresh is a freshwater fish and seafood supply chain platform.,Utham Gowda,Matrix Partners India,3000000.0,validation,2021,1,1,Multiple Founders
788,Northern Arc,2008,Chennai,Financial Services,Northern Arc Capital (Formerly known as IFMR Capital) is a Non-Banking Finance Company.,Kshama Fernandes,U.S. International Development FiNonece Corp,10000000.0,others,2021,1,1,Multiple Founders
789,Qoohoo,2020,Bangalore,Media,A platform for creators to build immersive connections with their fans and followers and monetize them.,"Vimal Singh Rathore, Aseem Gupta",Angel investors,800000.0,validation,2021,2,2,Multiple Founders
790,IGL,2016,Mumbai,Entertainment,Indian Gaming League is the premier eSports platform in India.,Yash Pariani,Hungama,500000.0,others,2021,1,1,Multiple Founders
791,AMPM,2018,Gurgaon,E-Commerce,24*7 convenience store,Shubham Gupta,Agility Venture Partners,200000.0,others,2021,1,1,Multiple Founders
