,company_brand,founded,headquarter,sector,about_company,founders,investor,amount,stage,year,founder Count,num_founders,FounderCategory
1338,Krimanshi,2015,Jodhpur,HealthTech,Krimanshi aims to increase rural income by improving the productivity of Indian cattle with better quality feed.,Nikhil Bohra,ajasthan Venture Capital Fund,600000.0,validation,2020,1,1,Multiple Founders
1339,Instoried,2018,Bangalore,AI,Instoried is an augmented writing platform which improves customer interest and engagement.,"Sharmin Ali, Sutanshu Raj",Venture Catalysts,1000000.0,early traction,2020,2,2,Multiple Founders
1340,PlayerzPot,2015,Mumbai,Entertainment,"Favorite fantasy cricket, football & kabaddi leagues online to win daily cash and prizes","Yogesh, Mitesh Gangar",None,3000000.0,early traction,2020,2,2,Multiple Founders
1341,Instamojo,2012,Bangalore,Financial Services,"Instamojo is an on-demand payments platform that enables entrepreneurs to build, manage, and grow their business online.","Aditya Sengupta, Akash Gehani, Harshad Sharma, Sampad Swain",BAS,3000000.0,others,2020,4,4,Multiple Founders
1342,Turtlemint,2015,Mumbai,HealthTech,Turtlemint has built Indian personalized insurance platform,"Anand Prabhudesai, Dhirendra Mahyavanshi, Kunal Shah",Nexus Venture Partners,30000000.0,others,2020,3,3,Multiple Founders
1343,Arata,2017,Delhi,E-Commerce,Arata is an e-commerce site for beauty products and cosmetics.,"Dhruv Madhok, Dhruv Bhasin",DSG Consumer Partners,1000000.0,early traction,2020,2,2,Multiple Founders
1344,MPL,2018,Bangalore,Entertainment,Mobile Premier League is a skill-based eSports platform used to offer cash prizes while playing games.,"Sai Srinivas Kiran G, Shubham Malhotra",Pegasus Tech Ventures,5000000.0,others,2020,2,2,Multiple Founders
1345,True Balance,2014,Gurgaon,Financial Services,True Balance is a digital wallet that enables users to access utility bill payment and other financial products.,"Cheolwon Lee, Jay Yi, Martin Lee",IBK Capital,28000000.0,others,2020,3,3,Multiple Founders
1346,Thrive,2020,Mumbai,Food Industry,"Thrive is all-in-one restaurant ordering suite for table ordering, pickup, and delivery with marketing in-built.","Dhruv Dewan, Krishi Fagwani",Whiteboard Capital,3000000.0,early traction,2020,2,2,Multiple Founders
1347,Kitchens Centre,2019,Delhi,Real Estate,Kitchens Centre offers turnkey solutions to cloud kitchens.,Lakshay Jain,Jonathan Swanson,3000000.0,early traction,2020,1,1,Multiple Founders
1348,Prescribe,2019,Chennai,HealthTech,Provide online services to patients by leveraging WhatsApp.,Nived Narayanan,Titan Capital,100000.0,others,2020,1,1,Multiple Founders
1349,Nepra,2006,Ahmedabad,Service industry,NEPRA Resource Management provides waste management solutions in India.,Sandeep Patel,Asha Impact,18000000.0,early traction,2020,1,1,Multiple Founders
1350,inFeedo,2013,Gurgaon,AI,"inFeedo is a predictive people analytics company helping 300,000+ employees in 100+ companies make their voice feel heard and valued.",Tanmaya Jain,Peyush Bansal,3200000.0,others,2020,1,1,Multiple Founders
1351,Shilpa Sciences,2014,Bangalore,HealthTech,Shilps Sciences is a healthtech platform that claims to have solved gene editing by accelerating single gene cell applications.,Ashwin Lal,AngelList India,3000000.0,early traction,2020,1,1,Multiple Founders
1352,Arzooo,2016,Bangalore,Tech Startup,"B2B retail tech platform transforming 300,000+ SMEs in electronics space with its flagship ""Go Store"" product","Khushnud Khan, Rishi Raj Rathore",3Lines,3000000.0,others,2020,2,2,Multiple Founders
1353,MindTickle,2011,Pune,SaaS platform,MindTickle offers the industry's most comprehensive sales readiness solution for closing knowledge and skill gaps in customer-facing teams.,"Deepak Diwakar, Krishna Depura, Mohit Garg, Nishant Mungali",Canaan Partners,100000000.0,others,2020,4,4,Multiple Founders
1355,Slice,2016,Bangalore,Financial Services,Slice is a card for first-time credit card users. They are inventing the future of finance for young Indians,"Deepak Malhotra, Rajan Bajaj",Better Capital,5000000.0,others,2020,2,2,Multiple Founders
1356,Rapawalk,2017,Bangalore,E-Commerce,Rapawalk is an online brand that offers a personalized service of creating your own shoes.,"Kashif Mohammad, Aravind Maddireddy",Sanjay RamakrishNone,300000.0,validation,2020,2,2,Multiple Founders
1357,Oga Fit's,2017,Bangalore,HealthTech,The new-age home workout app that gives you an unmatched boutique digital fitness studio experience.,Ashish Rawat,9Unicorns,3000000.0,early traction,2020,1,1,Multiple Founders
1358,LAVAL,2016,Bangalore,Fashion and lifestyle,"Laval Cosmetics, affordable makeup for all ages","Shrishti, Prithika",Jazal Group,3000000.0,early traction,2020,2,2,Multiple Founders
1359,Stride Ventures,2019,Delhi,Financial Services,Stride Ventures is a venture capital firm in India which aims to invest in innovative startups across the country.,Ishpreet Gandhi,Small Industries Development Bank of India,80000000.0,others,2020,1,1,Multiple Founders
1360,BlackSoil,2016,Mumbai,Financial Services,Blacksoil Advisory is an independent boutique advisory firm.,Ankur Bansal,None,10000000.0,others,2020,1,1,Multiple Founders
1361,Biocon,1978,Bangalore,HealthTech,"Biocon is a healthcare and technology, company focused on biotechnology.",Kiran Mazumdar-Shaw,Goldman Sachs,15000000.0,others,2020,1,1,Multiple Founders
1362,Clientjoy,2013,Gujarat,AI,Client Management Software For Modern Agencies.,"Abhishek Doshi, Anupama Panchal, Shashwat Bhatt, Yash Shah",LetsVenture,800000.0,early traction,2020,4,4,Multiple Founders
1363,Xpressbees,2015,Pune,E-Commerce,Xpressbees is an e-commerce logistics company that provides reliable logistics solutions to its partners.,"Amitava Saha, Supam Maheshwari",Alibaba Group,100000000.0,others,2020,2,2,Multiple Founders
1364,GalaxyCard,2017,Gurgaon,Financial Services,Mobile based Instant credit card. | Easiest way to get a credit card. Get one in 3 minutes,"Amit Kumar, Gunjeet Singh",India Accelerator,3000000.0,validation,2020,2,2,Multiple Founders
1365,Wellness Forever,2008,Mumbai,HealthTech,Wellness Forever is the one-stop destination for wellness,"Ashraf Biran, Gulshan Bakhtiani, Mohan Chavan",Poonawalla,100000000.0,others,2020,3,3,Multiple Founders
1366,MoooFarm,2019,Gurgaon,AgriTech,MoooFarm is an information technology company that bridges the technology gap to help marginalized dairy farmers.,"Param Singh, Aashna Singh, Abhijeet Mittal, Jitesh Arora",Navus Ventures,500000.0,validation,2020,4,4,Multiple Founders
1367,BitClass,2020,Bangalore,InfoTech & Services,BitClass is a PaaS solution which helps teachers set up their independent live classes,"Gunjan Kejriwal, Utsav Tiwary",AET Japan,2000000.0,validation,2020,2,2,Multiple Founders
1368,Gonuts,2020,Mumbai,Entertainment,Personalised Video shoutouts from favourite celebrity.,"Vinamra Pandiya, Mayank Gupta, Joji George",Sweta Rau,400000.0,validation,2020,3,3,Multiple Founders
1369,Uolo,2013,Bangalore,Education,Uolo Technology is founded by paranoid parents who want to make a difference to preschool experience.,"Pallav Pandey, Ankur Pandey, Siddharth Singh",ajul Garg,2000000.0,validation,2020,3,3,Multiple Founders
1370,Kirana King,2014,Jaipur,Retail,"A revolutionary idea of standardization, digitization & centralization to traditional Grocery system.",Anup Kumar,ajasthan Venture Capital Fund,900000.0,early traction,2020,1,1,Multiple Founders
1371,Jade Forest,2012,Delhi,Beverages,"NATURALLY THE BEST From zero artificial ingredients in our drinks to the way they make you feel, we bring you a bespoke range of natural mixers.","Punweet Singh, Shuchir Suri",None,250000.0,validation,2020,2,2,Multiple Founders
1372,iKure,2010,Kolkata,HealthTech,iKure is a social enterprise that delivers primary healthcare and wellness & prevention services to communities in India,Sujay Santra,atan Tata,3000000.0,others,2020,1,1,Multiple Founders
1373,FrontRow,2008,Bangalore,Education,"Comprehensive courses, taught by idols.","Mikhil Raj, Shubhadit Sharma, Ishaan Preet Singh",Lightspeed,3200000.0,validation,2020,3,3,Multiple Founders
1374,Reliance Retail,2006,Mumbai,E-Commerce,Reliance Retail Ventures Limited is a subsidiary company of Reliance Industries Limited.,Mukesh Ambani,Abu Dhabi Investment Authority,10000000.0,others,2020,1,1,Multiple Founders
1375,TUBBR,2019,risco,Media,World's First Personal Social Network,"Saurabh Uttam, Ravi Singhal",Global Ascent Partners,3000000.0,others,2020,2,2,Multiple Founders
1376,Ather Energy,2013,Bangalore,Transportation,Ather Energy is a manufacturer of electric scooters.,"Arun Vinayak, Swapnil Jain, Tarun Mehta",HeroMotoCorp Ltd and Sachin Bansal,35000000.0,early traction,2020,3,3,Multiple Founders
1377,Routematic,2007,Bangalore,AI,Vision is to enable a safer and more comfortable commute to work for employees of India Inc.,"Sriram Kannan, Surajit Das",VAMM Ventures,2000000.0,others,2020,2,2,Multiple Founders
1378,LivFin,2017,Delhi,Financial Services,LivFin is a non-banking financial company registered with the Reserve Bank of India (RBI),akesh Malhotra,DEG,4700000.0,others,2020,1,1,Multiple Founders
1379,Universal Sportsbiz Pvt Ltd,2012,Bangalore,Fashion startup,A fashion startup based in Bengaluru.,Anjana Reddy,Accel,3000000.0,others,2020,1,1,Multiple Founders
1380,Lattu Kids,2017,Mumbai,Education,Lattu kids is an edutainment platform for preschool kids.,Vivek Bhutyani,Mumbai Angels Network,3000000.0,others,2020,1,1,Multiple Founders
1381,Eggoz,2016,Indore,Food & Bevarages,"Eggoz is a brand of fresh and chemical-free eggs, produced in tech-enabled & nutrition-engineered deep integration partnership with farmers.","Abhishek Negi, Aditya Singh, Pankaj Pandey, Uttam Kumar",AVANA Capital,1500000.0,early traction,2020,4,4,Multiple Founders
1382,Steradian Semiconductors,2016,Bangalore,InfoTech & Services,Semiconductor company focused on CMOS millimeter wave products for Radar.,"Gireesh Rajendran, Ashish Lachhwani, Apu Sivadas, Rakesh Kumar and Alok Joshi",ndiya Partners.,3000000.0,others,2020,4,4,Multiple Founders
1383,CHARGE+ZONE,2018,Gujarat,Transportation,"Charge+Zone provides services in renewable energy solutions, product development, and software engineering company.","Kartikey Hariyani, Pavan Bakeri",Mumbai Angels,3000000.0,early traction,2020,2,2,Multiple Founders
1384,Stones2milestones,2008,Gurgaon,Education,Stones2milestones is India (Delhi) Based EdTech Company,"Kavish Gadia, Nikhil Saraf",Menterra Venture Advisors,2000000.0,others,2020,2,2,Multiple Founders
1385,Udacity,2011,San Francisco,Education,"Udacity develops an online learning platform offering programs in artificial intelligence, machine learning, and robotics sector.","David Stavens, Mike Sokolsky, Sebastian Thrun",Hercules Capital,75000000.0,others,2020,3,3,Multiple Founders
1386,AjnaLens,2014,Thane,Entertainment,"AjnaLens develops AR/VR wearables primarily for the Defence, Education and enterprise customers.","Abhijit Patil, Abhishek Tomar, Pankaj Raut",Mohsin Hani Al Bahrani,1000000.0,others,2020,3,3,Multiple Founders
1387,Gully Network,2019,Bangalore,E-Commerce,Gully Network is a tech-enabled network of mid-sized grocery stores.,"Ajay Nain, Prateek Chaturvedi",CP Ventures,1200000.0,early traction,2020,2,2,Multiple Founders
1388,TurboHire,2018,Hyderabad,HR,Talent Intelligence Platform for enterprises that helps recruiters discover the right candidates for a job using a Human-like AI,"Abhishek Kabra, Aman Gour",Kia Ora Ventures,1000000.0,validation,2020,2,2,Multiple Founders
1389,Traya,2016,Mumbai,HealthTech,work with our customers closely to get their hair health sorted for long-term effective results,"Altaf Saiyed, Saloni Anand",Kae Capital,3000000.0,validation,2020,2,2,Multiple Founders
1390,Charcoal Eats,2015,Mumbai,others,"In the last five years, have served over 1.5 million orders and enjoy high customer satisfaction.","Anurag Mehrotra, Krishnakant Thakur, Mohammed Bhol, Gautam Singh",Lokmat Investments,2000000.0,others,2020,4,4,Multiple Founders
1391,Mitron TV,2020,Bangalore,Entertainment,Mitron is a free short videoplatform for next generation,"Shivank Agarwal, Anish Khandelwal",9Unicorns,3000000.0,others,2020,2,2,Multiple Founders
1392,Svami,2016,Mumbai,Food & Bevarages,Svami is the result of three seasoned drinkers extending their love for libations to the larger world of drinks.,Sahil Jatana,Niren Shah,800000.0,others,2020,1,1,Multiple Founders
1393,Dhurnia,2018,Dhingsara,Education,Developer of an online learning platform intended for various competitive exam preparations.,"Ajay Kumar, Murari Singh",Chandigarh Angels Network,100000.0,others,2020,2,2,Multiple Founders
1394,Expertrons,2019,Mumbai,Education,Expertrons is an AI video bot platform created to help students and professionals prepare for interviews.,Jatin Solanki,ohit ChaNonea,3000000.0,others,2020,1,1,Multiple Founders
1395,Leena AI,2015,New York,AI,Leena AI offers a human resource management platform that transforms employee experience with conversational AI.,"Adit Jain, Anand Prajapati, Mayank Goyal",Alan Patricof,8000000.0,others,2020,3,3,Multiple Founders
1396,Bizlog,2016,Bangalore,Logistics,Bizlog Value Chain enables re-commerce and circular economy through unique REVERSE LOGISTICS engine.,"HS Srinivasan, Krishnan Rajan, E.V. Shunmugam",IAN Fund,1000000.0,others,2020,3,3,Multiple Founders
1397,Tamasha.live,2020,Mumbai,Entertainment,"Tamasha offers a platform for influencers to host live, video based, real money contests and games.","Saurabh Gupta, Siddharth Swarnkar",9Unicorns,300000.0,others,2020,2,2,Multiple Founders
1398,Fedo,2017,Bangalore,AI,Artificial Intelligence based Credit Score for Health,"Arun Mallavarapu, Prasanth Madavana",AIM Smart City,1000000.0,others,2020,2,2,Multiple Founders
1399,FabHotels,2015,Gurgaon,Hospitality,Fabhotels is the online aggregator for hotel rooms. It aims to provide standardized services at economical budgets.,"Adarsh Manpuria, Vaibhav Aggarwal",B Investments Pte. Ltd,1000000.0,others,2020,2,2,Multiple Founders
1400,Freshokartz,2016,Jaipur,AgriTech,"Freshokartz provides soil data based crop and fertilisers recommendation to farmers and delivery seeds, pesticides","Chandrakanta, Rajendra Lora",ajasthan Venture Capital Fund,1000000.0,early traction,2020,2,2,Multiple Founders
1401,FlexiLoans,2016,Mumbai,Financial Services,"an online lending platform started with an endeavour to solve the problem that SMEs face in accessing Quick, Flexible and Adequate funds for growing their Businesses.","Abhishek Kothari, Deepak Jain, Manish Lunia, Ritesh Jain",>Vikram Sud,6000000.0,others,2020,4,4,Multiple Founders
1402,Agrix,2020,Patna,AgriTech,"Farming-as-a-service (covering farm machinery and agri input services) and provides market linkages, especially for fragmented farm owners.","Nilay Pandey, Saurav Singh, Vivek Kumar",Maple Capital Advisors,3000000.0,others,2020,3,3,Multiple Founders
1403,BharatAgri,2017,Pune,AgriTech,A Smart Farming Technology Platform for Indian Farmers,"Siddharth Dialani, Sai Gole",021 Capital,3000000.0,early traction,2020,2,2,Multiple Founders
1404,FreshtoHome,2015,Bangalore,E-Commerce,Freshtohome is an e-commerce platform for fresh and chemical-free seafood.,Shan Kadavil,Ascent Capital,121000000.0,early traction,2020,1,1,Multiple Founders
1405,Credable,2017,Mumbai,Financial Services,CredAble provides working capital & supply chain finance programs for large enterprises and their suppliers and distributors.,Nirav Choksi,Oaks Asset Management,4500000.0,others,2020,1,1,Multiple Founders
1406,Railofy,2019,Mumbai,Transportation,Railofy is a WL & RAC protection that enables waitlisted passengers to reach their destination at the lowest possible price.,"ohan Dedhia, Vaibhav Saraf, Hrishabh Sanghvi",oots Ventures,5000000.0,validation,2020,3,3,Multiple Founders
1407,Finova Capital,2016,Jaipur,Financial Services,Finova Capital is a non-banking financial company.,"Mohit Sahney, Sunita Sahney",Sequoia Capital India,55000000.0,others,2020,2,2,Multiple Founders
1408,Teachmint,2020,Bangalore,Edtech,Teachmint is an easy to use platform for tutors to conduct unlimited live classes and manage their classrooms,"Mihir, Payoj Jain, Divyansh Bordia, Anshuman Kumar",Lightspeed India,3500000.0,validation,2020,4,4,Multiple Founders
1409,Peel-Works,2010,Mumbai,E-Commerce,Peel-Works is a tech and data analytics company specializing in e-commerce for corner stores.,"Sachin Chhabra, Nidhi Ramachandran",CESC Ventures,3000000.0,others,2020,2,2,Multiple Founders
1410,Janani,2020,Bangalore,HealthTech,Janani aims to make the process of infertility treatment and assisted fertilisation easier,Nilay Mehrotra,9Unicorns,200000.0,validation,2020,1,1,Multiple Founders
1411,Credgenics,2018,Gurgaon,Financial Services,"Credgenics is a tech-enabled platform backed by Titan Capital, helping fintech lenders and Banks in their critical NPA reduction","Anand Agrawal, Mayank Khera, Rishabh Goel",Accel,3300000.0,validation,2020,3,3,Multiple Founders
1412,Finelistings,2015,Delhi,Luxury car startup,A Used Luxury Car Marketplace,Aneesh Mathur,Justdial,3000000.0,others,2020,1,1,Multiple Founders
1413,Wellversed,2018,Delhi,HealthTech,Wellversed Health enables production of customised clinical food products specific to health requirements of a demography or an individual.,"Aanan Khurma, Aditya Seth, Ripunjay Chachan",KLUB Works,3000000.0,early traction,2020,3,3,Multiple Founders
1415,Jumbotail,2015,Bangalore,E-Commerce,"Jumbotail is solving an important problem of organising food and grocery ecosystem in India through technology, data science and design.","Ashish Jhina, Karthik Venkateswaran",Nexus Venture Partners and 23 High Networth Individuals (HNIs),11000000.0,early traction,2020,2,2,Multiple Founders
1416,Winzo,2018,Delhi,Entertainment,WinZO is a mobile e-sports social gaming platform that offers monetary benefits and prizes to players.,"Paavan Nanda, Saumya Singh Rathore",Makers Fund,2000000.0,others,2020,2,2,Multiple Founders
1417,mCaffeine,2015,Mumbai,Fashion and lifestyle,"MCaffeine is a personal care brand that offers caffein-infused face, body, and hair care products.","Tarun Sharma, Vikas Lachhwani",PSG Ventures,5000000.0,early traction,2020,2,2,Multiple Founders
1418,Pocket FM,2018,Bangalore,others,Pocket FM is an audiobook & podcast app that brings you over 10K+ popular audiobooks.,ohan Nayak,Times Group,5000000.0,early traction,2020,1,1,Multiple Founders
1419,Snackible,2015,Mumbai,HealthTech,Snackible operates a health-food production company designed to sell healthy snack food via online and offline channels.,None,Mumbai Angels,3000000.0,others,2020,1,1,Multiple Founders
1420,FreshtoHome,2015,Bangalore,E-Commerce,Freshtohome is an e-commerce platform for fresh and chemical-free seafood.,Shan Kadavil,Ascent Capital,16000000.0,others,2020,1,1,Multiple Founders
1421,Jumbotail,2015,Bangalore,Retail,Jumbotail is solving an important problem of organising food and grocery ecosystem in India,"Ashish Jhina, Karthik Venkateswaran",Nexus Venture Partners,11000000.0,early traction,2020,2,2,Multiple Founders
1422,Nykaa,2012,Mumbai,E-Commerce,Nykaa is an online marketplace for different beauty and wellness products.,alguni Nayar,Katrina Kaif,3000000.0,others,2020,1,1,Multiple Founders
1423,TagZ Foods,2019,Bangalore,Food,TagZ Foods is a supplier of snacks and food products.,"Sagar Bhalotia, Anish Basu Roy",xfinity Venture Partners,3000000.0,others,2020,2,2,Multiple Founders
1424,Genius Teacher,2016,Mumbai,Edtech,"Genius Teacher creates engaging educational content, delivers fun learning experience to the students","Advitiya Sharma, Gaurav Lahoti",Sandeep Tandon,2000000.0,others,2020,2,2,Multiple Founders
1425,Krimanshi Feeds,2015,Jodhpur,Nutrition sector,Krimanshi aims to increase rural income by improving the productivity of Indian cattle with better quality feed.,Nikhil Bohra,ajasthan Venture Capital Fund,500000.0,others,2020,1,1,Multiple Founders
1426,Origo,2010,Gurgaon,AgriTech,Provider of marketing and warehousing services for agricultural commodities.,"Sunoor Kaul,",Northern Arc Capital,4000000.0,others,2020,2,2,Multiple Founders
1427,GetVantage,2019,Mumbai,Financial Services,GetVantage is India and Southeast Asia's first fintech enabled Revenue-based financing platform.,"Amit Srivastava, Bhavik Vasa, Sachin Tagra, Sachin Tagra",Samyakth Capital,5000000.0,validation,2020,4,4,Multiple Founders
1428,Betterplace,2015,Bangalore,InfoTech & Services,Developer of a digital verification platform designed to manage the semi-formal workforce.,"Saurabh Tandan, Pravin Agarwala",Jungle Ventures,10000000.0,early traction,2020,2,2,Multiple Founders
1429,Biddano,2016,Mumbai,HealthTech,India's 1st tech-enabled healthcare logistics platform.,Talha Shaikh,Windrose Capital,600000.0,early traction,2020,1,1,Multiple Founders
1430,InVideo,2017,Mumbai,Entertainment,InVideo enables you to transform your content into great videos.,"Harsh Vakharia, Pankit Chheda, Sanket Shah",Base Partners,15000000.0,early traction,2020,3,3,Multiple Founders
1431,Arzooo,2016,Bangalore,Retail Tech,"Retail tech platform empowering 300,000+ small retailers in electronics space to compete with big organised players and increase sales","Khushnud Khan, Rishi Raj Rathore",3Lines,7500000.0,early traction,2020,2,2,Multiple Founders
1432,Hubilo,2020,San Francisco,InfoTech & Services,World’s smartest virtual event platform that brings Experience & Intelligence together,"Mayank Agarwal, Vaibhav Jain",Nishant Rao,4500000.0,validation,2020,2,2,Multiple Founders
1433,BASIC Home Loan,2020,Gurgaon,Financial Services,"A platform for automating home loans for middle and low-income households in India,",Atul Monga,Picus Capital,5000000.0,validation,2020,1,1,Multiple Founders
1434,Ketos,2015,San Francisco,AI,KETOS provides hardware and software analytics solutions and real-time data for usage and flow across water systems.,Meena Sankaran,Citi Ventures,18000000.0,others,2020,1,1,Multiple Founders
1435,SUGAR cosmetics,2012,Mumbai,Fashion and lifestyle,It is a cruelty-free makeup brand providing cosmetics that is high on style and higher on performance.,"Kasuhik Mukherjee, Vineeta Singh",A91 Partners,2000000.0,others,2020,2,2,Multiple Founders
1436,Signzy,2015,Bangalore,Financial Services,It is creating 'building blocks for a Digital Trust system.,"Ankit Ratan, Ankur Pandey, Arpit Ratan",GenNext Ventures,5400000.0,others,2020,3,3,Multiple Founders
1437,Ahaguru,2012,Chennai,Edtech,"It is conducting IIT JEE Coach for Physics, Math and Chemistry easily.","Gomathi S, Dr Balaji Sampath",ANoned Mahindra,3000000.0,early traction,2020,2,2,Multiple Founders
1438,Tekion,2016,San Ramon,AI,It is a cloud-built platform with advanced machine learning and AI capabilities for a personalized and seamless consumer experience.,"Guru Sankararaman, Jay Vijayan",Alliance Ventures,150000000.0,early traction,2020,2,2,Multiple Founders
1439,Brighteye Ventures,2017,Paris,Edtech,Education technology venture capital firm.,David guerin,Tandem,5400000.0,others,2020,1,1,Multiple Founders
1440,EzeRx,2018,Kolkata,HealthTech,Developer and manufacturer of medical devices,"Amit mandahar, Chaitali roy",Indian Oil Corporation,200000.0,validation,2020,2,2,Multiple Founders
1441,VitalTech,2018,Plano,HeathTech,"VitalTech is a develop technologies that empower patients to better care for their safety,",Anjan Panneer Selvam,Tech Mahindra,3000000.0,validation,2020,1,1,Multiple Founders
1442,Genius Teacher,2016,Mumbai,Edtech,"Genius Teacher creates engaging educational content, delivers fun learning experience to the students","Advitiya Sharma, Gaurav Lahoti",Whiteboard Capital,2000000.0,others,2020,2,2,Multiple Founders
1443,Ultraviolette Automotive,2014,Bangalore,Transportation,Ultraviolette Automotive is a technology startup working on electric two-wheelers and energy infrastructure.,"Narayan Subramaniam, Niraj Rajmohan",TVS Motor Company,4000000.0,early traction,2020,2,2,Multiple Founders
1444,Tring,2019,Mumbai,Media,"Tring is a celebrity engagement platform, for all occasions including birthday, anniversaries, get well soon messages.","Akshay Saini, Rahul Saini, Pranav Chabhadia",Sujeet Kumar,3000000.0,others,2020,3,3,Multiple Founders
1445,Rare Planet,2015,Kolkata,Retail,Rare Planet sells handicrafts made by local artisans.,"anodeep Saha, Vijay Kumar",Venture Catalysts,400000.0,early traction,2020,2,2,Multiple Founders
1446,GoodGamer,2020,Bangalore,Entertainment,GoodGamer is India's first Daily Fantasy Sports and true Esports gaming platform.,Charles Creighton,None,2500000.0,validation,2020,1,1,Multiple Founders
1447,InnAccel,2012,Bangalore,HealthTech,"A building a portfolio of novel medical devices designed, engineered, and priced for global Emerging Markets.",Siraj Dhanani,Mount Judi Ventures,1500000.0,early traction,2020,1,1,Multiple Founders
1448,Tiliter,2017,Sydney,Retail,Software that uses computer vision to recognise products without barcodes,"Chris Sampson, Marcel Herz, Martin Karafilis",AngelList,7500000.0,others,2020,3,3,Multiple Founders
1449,Slintel,2016,San Francisco,Marketing,"Slintel, a leader in capturing technographics-powered buying intent, helps companies uncover the 3% of active buyers in their target market.","Deepak Anchala, Rahul Bhattacharya, Ranjana TN",Accel,4200000.0,others,2020,3,3,Multiple Founders
1450,SoOLEGAL,2015,Delhi,LegalTech,"SoOLEGAL is a global integrated directory of lawyers, legal aid organizations, and Law firms.",Manish Kaul,None,4000000.0,others,2020,1,1,Multiple Founders
1451,HobSpace,2019,Mumbai,Edtech,India's Activity Hub for Kids,"Priya Goel Sheth, Harsh Jain",Artha Venture,200000.0,validation,2020,2,2,Multiple Founders
1452,Supplynote,2015,Noida,AI,Supplynote is India's leading procurement platform with a unique stack of SAAS and E-commerce to solve the procurement problem,"Abhishek Verma, Harshit Mittal, Kumar Kushang, Nitin Prakash",MOX,500000.0,validation,2020,4,4,Multiple Founders
