,company_brand,founded,headquarter,sector,about_company,founders,investor,amount,stage,year,founder Count,num_founders,FounderCategory
1958,Fittr,2018,Pune,HealthTech,Fitness Social Network & Consultation Platform,Jitendra Chouksey,Sequoia Capital Surge,2000000.0,others,2020,1,1,Multiple Founders
1959,AsknBid,2018,Bangalore,Financial Services,It builds algorithmic investing-based tech products,"Suresh Bavisetti, Paarth Dhar",avikanth Reddy & Mumbai Angel Network,3000000.0,others,2020,2,2,Multiple Founders
1960,Bira91,2015,Bangalore,Food Industry,Craft beer maker,Ankur Jain,Sequoia Capital,20000000.0,early traction,2020,1,1,Multiple Founders
1961,Finaureus Technologies,2017,Pune,Financial Services,Provides investment management solutions,"Arindam Ghosh, U R Bhatt",Pinetree Capital,3000000.0,early traction,2020,2,2,Multiple Founders
1962,Daily Ninja,2014,Haryana,E-Commerce,Online Milk Delivery startup,Sagar Yarnalkar,Big Basket,349800.0,others,2020,1,1,Multiple Founders
1963,Guvi Geek Network Pvt Ltd,2014,Chennai,Edtech,Operates vernacular-language based education,"SP Balamurugan, Arun Prakash, Sri Devi",ducation Catalyst Fund,786000.0,early traction,2020,3,3,Multiple Founders
1964,LoadShare,2017,Bangalore,Logistics,Provides technology based solutions to SMEs in logistics,"aghuram Talluri, Tanmoy Karmakar, Rakib Ahmed",CDC Group,2004000.0,early traction,2020,3,3,Multiple Founders
1965,Vedantu,2010,Bangalore,Edtech,Onine learning platform,"Saurabh Saxena, Pulkit Jain, Anand Prakash, Vamsi Krishna",KB Global Platform Firm,6800000.0,early traction,2020,4,4,Multiple Founders
1966,Indusface,2004,None,IT,It provides IT security solutions,"Venkatesh Sundar, Nandini Tandon",Tata Capital Growth Fund II,5000000.0,others,2020,2,2,Multiple Founders
1967,DMI Group,2008,Delhi,Financial Services,Pan-India Credit providing platform,"Shivashish Chatterjee, Yuvraja Singh",NXC Corporation,123000000.0,others,2020,2,2,Multiple Founders
1968,Spintly,2017,Goa,AI,It is a wireless cloud-based access control system,"ohin Parkar, Malcolm Dsouza",Saltwater Venture Sparks,248000.0,early traction,2020,2,2,Multiple Founders
1969,Credr,2014,Mumbai,Transportation,A marketplace to buy and sell used bikes and scooters,Mittal,Stride Ventures,3000000.0,others,2020,1,1,Multiple Founders
1970,Bijak,2014,Gurgaon,AgriTech,"It is a platform that gives agricultural commodity at better prices, increased working capital, and optimised logistics","Nukul Upadhye, Mahesh Jakhotia, Jitender Bedwal, Daya Rai, Nikhil Tripathi",TP Global,12000000.0,early traction,2020,5,5,Multiple Founders
1971,Bugworks,2014,Bangalore,HealthTech,A drug discovery company that aims to discover novel treatment options for resistant bacterial infections,Anand Anandkumar,University of Tokyo Edge Capital,7500000.0,others,2020,1,1,Multiple Founders
1972,DrinkPrime,2015,Bangalore,HealthTech,Water purifier subscription service,"Manas Ranjan Hota, Vijender Reddy",Abhishek Goyal,3000000.0,validation,2020,2,2,Multiple Founders
1973,Yap,2016,Chennai,Financial Services,Banking and payment products-focused API platform,"Madhusudanan R, Muthukumar and Prabhu",BeeNext,4500000.0,early traction,2020,2,2,Multiple Founders
1974,UzhavarBumi,2017,Tamil Nadu,Food Industry,Provides fresh dairy products,"Vetrivel Palani, Paneerselvam",Angel Network,3000000.0,others,2020,2,2,Multiple Founders
1975,Tattva,2018,Delhi,Fashion and lifestyle,Sells its organic and beauty products via marketplace,"Megha Wadhwa, Karnesh Mahendru",Sukhbir Singh,150000.0,others,2020,2,2,Multiple Founders
1976,Pariksha,2015,Pune,Edtech,Platform for vernacular test-preparation,"Karanvir Singh, Utkarsh Bagri, Vikram Shekhawat, Deepak Choudhary",INSEAD Angels,3000000.0,early traction,2020,4,4,Multiple Founders
1977,DailyHunt,2014,None,Media,News aggregator,Virendra Gupta,Bytedance,24000000.0,others,2020,1,1,Multiple Founders
1978,NoBroker,2014,Bangalore,Real Estate,Online real estate rental startup,"Amit Kumar Agarwal, Akhil Gupta, Saurabh Garg",General Atlantic,30000000.0,others,2020,3,3,Multiple Founders
1979,Box8,2011,Mumbai,Food Industry,Enables to order food online,"Amit Raj, Anshul Gupta",IIFL Seed Ventures Fund,4000000.0,others,2020,2,2,Multiple Founders
1980,Capital Float,2013,Bangalore,Financial Services,Online platform that provides working capital finance to SMEs,"Gaurav Hinduja, Sashank Rishyasringa",ibbit Capital,15000000.0,others,2020,2,2,Multiple Founders
1981,ITILITE,2015,Bangalore,Travel & SaaS,Platform for business travel,"Mayank Kukreja, Anish Khadiya",Greenoaks Capital,13000000.0,early traction,2020,2,2,Multiple Founders
1982,Morning Context,2017,None,Media,A subscription-only digital media publisher,None,Angel investors,3000000.0,validation,2020,1,1,Multiple Founders
1983,Aavenir,2019,Ahmedabad,InfoTech & Services,Source-to-Pay Software,Ashish Bhandari,Accel,2000000.0,validation,2020,1,1,Multiple Founders
1984,Savvy Co op,2018,None,HealthTech,It connects patients with healthcare companies,Jen Horonjeff,Indie VC,3000000.0,others,2020,1,1,Multiple Founders
1985,BLive,2018,None,Tourism & EV,"It offers experiential, guided tours on smart electric bikes","Samarth Kholkar, Sandeep Mukherjee",Mumbai Angels Network,3000000.0,early traction,2020,2,2,Multiple Founders
1986,Yellow Messenger,2018,Bangalore,AI,It offers conversational chatbots,aghavendra Kumar Ravinutala,Lightspeed Venture Partners,20000000.0,early traction,2020,1,1,Multiple Founders
1987,Toch,2018,None,Media,AI based Video object detection and Tagging platform,"Vinayak Shrivastav, Saket Dandotia, Alok Patil",Inflection Point Ventures,400000.0,others,2020,3,3,Multiple Founders
1988,Ewar,2018,Bangalore,Entertainment,E-sports and real-time gaming startup,"Parth Chadha, Rahul Singh",Jindal Steels,200000.0,others,2020,2,2,Multiple Founders
1989,Setu,2018,None,Financial Services,"Offers open APIs across four categories: bills, savings, credit, and payments.","Sahil Kini, Nikhil Kumar",Lightspeed Venture,14259000.0,early traction,2020,2,2,Multiple Founders
1990,Wellthy Therapeutics,2018,Bangalore,HealthTech,It offers a digital therapeutics service,Abhishek Shah,Saama Capital,4000000.0,early traction,2020,1,1,Multiple Founders
1991,Power Gummies,2018,Delhi,HealthTech,Offers health supplements related gummies,Divij Bajaj,Venture Catalysts,3000000.0,others,2020,1,1,Multiple Founders
1992,Locale ai,2019,Bangalore,InfoTech & Services,It helps companies with moving assets  increase revenues and demand using real time location data and analytics,"ishabh Jain, Aditi Sinha",Better Capital,3000000.0,others,2020,2,2,Multiple Founders
1993,FarEye,2015,Delhi,Logistics,"It enables businesses to execute, track, predict and oprimize the movements of goods","Gaurav Srivastava, Gautam Kumar, Kushal Nahata",M12,24500000.0,early traction,2020,3,3,Multiple Founders
1994,Rebel Foods,2011,None,Food tech,It runs internet kitchen,"Jaydeep Barman, Kallol Bannerjee",Coatue Management,50000000.0,others,2020,2,2,Multiple Founders
1995,BankBazaar,2008,Chennai,Financial Services,Online marketplace that gives customers instant customised offers on loans and credit cards,"Adhil Shetty, Arjun Shetty, Rati Shetty,",Amazon,3800000.0,early traction,2020,4,4,Multiple Founders
1996,Porter,2014,Mumbai,Logistics,Logistics and fleet management,"Pranav Goel, Uttam Digga",Lightstone Global Funds,18370000.0,early traction,2020,2,2,Multiple Founders
1997,SugarBox,2013,Mumbai,InfoTech & Services,Hyperlocal data distribution platform,ohit Paranjpe,Zee Entertainment Enterprises Limited,68525000.0,others,2020,1,1,Multiple Founders
1998,Capital Float,2013,Bangalore,Financial Services,Online platform that provides working capital finance to SMEs,"Gaurav Hinduja, Sashank Rishyasringa",Amazon Inc`,4800000.0,early traction,2020,2,2,Multiple Founders
1999,Big Basket,2013,Bangalore,E-Commerce,Online grocery store,"Abhinay Choudhari, Hari Menon, Vipul Parekh, VS Sudhakar",Alibaba Holdings,60000000.0,others,2020,4,4,Multiple Founders
2000,Amica,2014,None,Financial Services,Neobanking startup,Jitendra Gupta,Hummingbird Ventures,2000000.0,others,2020,1,1,Multiple Founders
2001,Vedantu,2015,Bangalore,Edtech,Onine learning platform,"Saurabh Saxena, Pulkit Jain, Anand Prakash, Vamsi Krishna",Legend Capital,12500000.0,early traction,2020,4,4,Multiple Founders
2002,Fingerlix,2016,None,Food,"It provides ready-to-cook products such as batters, mixes, curries, dals, parathas etc.,","Shrikrishna Bharambe, Shripad Nadkarni, Varun Khanna, Abhijit Berde",Accel,1834000.0,others,2020,4,4,Multiple Founders
2003,Plop,2017,Mumbai,InfoTech & Services,It Provides an interactive fiction entertainment platform to entertain & educate Gen Z & Millennials in a language they understand,"Vineet Shetty, Anushka Shetty",Better Capital,3000000.0,validation,2020,2,2,Multiple Founders
2004,Zupee,2018,None,Entertainment,It runs live quiz tournaments on its app.,"Malhi, Siddhant Saurabh",Matrix Partners,8000000.0,early traction,2020,2,2,Multiple Founders
2005,DeHaat,2012,None,AgriTech,Online marketplace for farming services and products,Shashank Kumar,Sequoia Capital India,12000000.0,early traction,2020,1,1,Multiple Founders
2006,Lido Learning,2013,Mumbai,Edtech,Online teaching service,Sahil Sheth,Bace Capital,7500000.0,early traction,2020,1,1,Multiple Founders
2007,Aye Finance,2014,Gurgaon,Financial Services,A finance lender to SMEs,"Vikram Jetley, Sanjay Sharma",Undisclosed,23850000.0,others,2020,2,2,Multiple Founders
2008,Swiggy,2014,Bangalore,Food Industry,Platform to order food online from restaurants and getting it delievered,"Nandan Reddy, Sriharsha Majety, Rahul Jaimini",Tencent,43000000.0,early traction,2020,3,3,Multiple Founders
2009,Akna Medical,2018,None,HealthTech,Provides supply solutions for surgical and pharmaceutical products.,"Saurabh Pandey, Mahadevan Narayanamoni",LGT Lightstone Aspada,7000000.0,others,2020,2,2,Multiple Founders
2010,Zomato,2018,Gurgaon,Food Industry,Online food delivery and restaurant discovery platform,Deepinder Goyal,Pacific Horizon,5000000.0,others,2020,1,1,Multiple Founders
2011,RaRa Delivery,2018,None,Logistics,Provides same day delivery service for ecommerce businesses,Karan Bhardwaj,Der Shing Lim,800000.0,validation,2020,1,1,Multiple Founders
2012,JusPay,2018,Bangalore,Financial Services,Online payment solutions,Vimal Kumar,Vostok Emerging FiNonece,21600000.0,early traction,2020,1,1,Multiple Founders
2013,Obviously AI,2018,None,InfoTech & Services,It provides predictive insights to clients by leveraging their data,"Tapojit Debnath, Nirman Dave",Arka Venture Labs,3000000.0,others,2020,2,2,Multiple Founders
2014,Fingpay,2016,Mumbai,Financial Services,Provides payment solutions,"Pratyush Halen, Anuraag Agrawal",IvyCap Ventures,3500000.0,early traction,2020,2,2,Multiple Founders
2015,Recko,2017,Bangalore,InfoTech & Services,The platform enables AI-powered reconciliation of digital transactions,"Prashant Border, Saurya Prakash Sinha",Vertex Ventures,6000000.0,early traction,2020,2,2,Multiple Founders
2016,Furlenco,2012,Bangalore,E-Commerce,Furniture rental startup,Ajith Mohan Karimpana,Chowdry Associates,10000000.0,others,2020,1,1,Multiple Founders
2017,Mera Cashier,2019,Noida,Financial Services,App meant for small and micro businessmen to manage their transactions digitally,"Suneel Kumar, Gaurav Tomar, Sucharita Redd",Sukhbir Singh,150000.0,others,2020,3,3,Multiple Founders
2018,Kitchens Centre,2019,Delhi,Financial Services,Offers solutions to cloud kitchens by providing commercial space and kitchen infrastructure to assisting with branding and other services,Lakshay Jain,AngelList India,500000.0,validation,2020,1,1,Multiple Founders
2019,Camp K12,2016,Gurgaon,Edtech,It connects students with tutors online,"Anshul Bhagi, Sandeep Bhagi",Matrix Partners,4000000.0,validation,2020,2,2,Multiple Founders
2020,MedGenome,2013,Bangalore,HealthTech,Genetic diagnostic testing company,Sam Santhosh,LeapFrog Investments,55000000.0,early traction,2020,1,1,Multiple Founders
2021,Ergos,2012,Bangalore,AgriTech,It enables farmers to digitise their foodgrain and also provide access to supply chain solutions,"Kishor Jha, Praveen Kumar",Aavishkar Capital,4598000.0,others,2020,2,2,Multiple Founders
2022,Nykaa,2012,Mumbai,E-Commerce,Deals in cosmetic and wellness products,alguni Nayar,Steadview capital,13137000.0,others,2020,1,1,Multiple Founders
2023,Samadhan,2018,Delhi,Financial Services,They help find solutions to insurance related issues,"Deepak Bhuvneshwari Uniyal, Shilpa Arora, Shailesh Kumar, Sanjay Aggarwal",Venture Catalysts,3000000.0,validation,2020,4,4,Multiple Founders
2024,SaScan,2017,Bangalore,HealthTech,Cancer diagnostics startup,Subhash Narayanan,Unicorn India ventures,3000000.0,others,2020,1,1,Multiple Founders
2025,Lido Learning,2016,Mumbai,Edtech,Online teaching service,Sahil Sheth,Pecus Capital,3000000.0,others,2020,1,1,Multiple Founders
2026,CureFit,2016,Bangalore,HealthTech,"Integrated platform for food, fitness and meditation.","Mukesh Bansal, Ankit Nagori",Temasek,115000000.0,early traction,2020,2,2,Multiple Founders
2027,Nimesa,2018,Bangalore,InfoTech & Services,Cloud data managemnt solutions enterprise,"Tapesh Goyal, Rajesh Vaidhyanathan",Ideaspring capital,3000000.0,others,2020,2,2,Multiple Founders
2028,Design X,2018,Noida,AI,Builds IoT based products,Preet Arjun Singh,ThinkNext LLC,200000.0,validation,2020,1,1,Multiple Founders
2029,Driftly Electric,2018,Bangalore,Transportation,Electric vehicle startup,Sneha Roy,MG Motor India,3000000.0,others,2020,1,1,Multiple Founders
2030,Imstrong,2019,Bangalore,HealthTech,It is an online and live video-streaming platform that allows trainers and fitness enthusiasts to connect and engage in interactive online classes.,"Dilip Kumar, Selvan Thamarai, Deepti Nair",ainmatter,400000.0,validation,2020,3,3,Multiple Founders
2031,Craftsvilla,2019,Mumbai,Service industry,Online marketplace for ethnic wear,Monica Gupta. Manoj Gupta,Supera Investments,3900000.0,others,2020,1,1,Multiple Founders
2032,Rupifi,2020,Bangalore,Financial Services,Offers financial products for SMEs,"Anubhav Jain, Ankit Singh, Jawaid Iqbal",Ashneer Grover,3000000.0,validation,2020,3,3,Multiple Founders
2033,SnackAmor,2019,Mumbai,Food,It offers various healthy snacks,Deepak Grover,Undisclosed,3000000.0,validation,2020,1,1,Multiple Founders
2034,Zealthy,2019,Bangalore,HealthTech,"It connects women to healthproviders for specialities like infertility, maternity etc.,","ishi Malhotra, Akhil Gupta",KYT Ventures,3000000.0,validation,2020,2,2,Multiple Founders
2035,CoinDCX,2018,None,Financial Services,A cryptocurrency trading platform,Sumit Gupta,Polychain Capital,3000000.0,early traction,2020,1,1,Multiple Founders
2036,NuNu TV,2018,None,Media,Kids-focussed Youtube channel,None,isers Accelerators,670000.0,others,2020,1,1,Multiple Founders
2037,QTalk,2018,Bangalore,InfoTech & Services,Smart Phone Dialer,"Sagar Modi, Advaith Vishwanath",Accel India,1600000.0,validation,2020,2,2,Multiple Founders
2038,Shadez,2018,Mumbai,Real Estate,Paint Company,"Adarsh Anand, Amit Tiwari",Inflection Point Ventures,100000.0,validation,2020,2,2,Multiple Founders
2039,Excess2Sell,2017,Mumbai,E-Commerce,B2B Marketplace for Overstock & Surplus Inventory,ajan Sharma,Gautham Madhavan,1000000.0,others,2020,1,1,Multiple Founders
2040,Stanplus,2016,Hyderabad,HealthTech,Ambulance service,Prabhdeep Singh,Pegasus FinInvest,1500000.0,early traction,2020,1,1,Multiple Founders
2041,Pitstop,2015,Bangalore,Transportation,Doorstep car service,Mihir Mohan mishra,TPG-backed Group Landmark,2500000.0,early traction,2020,1,1,Multiple Founders
2042,Univariety,2015,Hyderabad,Edtech,Online marketplace that provides career counselling and college guidance,Jaideep Gupta,Info Edge,1100000.0,others,2020,1,1,Multiple Founders
2043,Peel Works,2010,Mumbai,InfoTech & Services,E-commerce for corner/retail stores.,"Sachin Chhabra, Nidhi Ramachandran",CESC Ventures,3000000.0,early traction,2020,2,2,Multiple Founders
2044,CoreStack,2016,Chennai,InfoTech & Services,Enterprise cloud governance technology startup,"zhilarasan Natarajan, Sabapathy Arumugam, Krishnakumar Narayanan, Thiruvalluvar NB",Naya Ventures,8500000.0,early traction,2020,4,4,Multiple Founders
2045,Vivriti Capital,2017,Chennai,Financial Services,Digital lending startup,"Gaurav Kumar, Vineet Sukumar",LGT Lightstone Aspada,50000000.0,early traction,2020,2,2,Multiple Founders
2046,Agnikul,2018,Chennai,Spacetech,"It designs, fabricates, tests and launch orbital class launch vehicles",Srinath Ravichandran,pi Ventures,3148000.0,early traction,2020,1,1,Multiple Founders
2047,Fintso,2020,None,Financial Services,Wealth management platform,"George Mitra, Rajan Pathak",ajeev Juneja,2600000.0,others,2020,2,2,Multiple Founders
2048,Khatabook,2017,Bangalore,Financial Services,It helps SMEs to maintain their accounts and ledger online.,avish Naresh,Mahendra Singh Dhoni,3000000.0,others,2020,1,1,Multiple Founders
2049,Smart Coin,2015,None,Financial Services,Consumer lending startup,"Amit Chandel, Rohit Garg, Vinay Kumar, Jayant Upadhyay",LGT LightstoneAspada,7000000.0,early traction,2020,4,4,Multiple Founders
2050,ZunRoof,2016,Gurgaon,Service industry,"It specialises in solar rooftop design, installation, and management using technology","Pranesh Chaudhary, Sushant Sachan",Godrej Investments,3000000.0,early traction,2020,2,2,Multiple Founders
2051,Shop101,2015,None,Media,Enables entrepreneurs to sell online,"Abhinav Jain, Aditya Gupta",Stellaris Venture Partners,3900000.0,early traction,2020,2,2,Multiple Founders
2052,OM Bhakti,2015,Bangalore,Consumer Goods,A puja cotton-wicks manufacturing startup,"Sridhar Joshi, Prashant Kulkarni",Venture Catalysts,3000000.0,validation,2020,2,2,Multiple Founders
2053,Lal10,2016,Uttar Pradesh,B2B,It helps Indian artisans and SMEs reach out to global retailers,"Maneet Gohil, Sanchit Govil, Albin Jose",Sorenson Impact,1100000.0,others,2020,3,3,Multiple Founders
2054,Anaxee Digital Runner,2016,Indore,InfoTech & Services,A tech-enabled ID verification and data collection startup,"Govind Agrawal, Arti Agrawal",Orios Venture Partners,3000000.0,others,2020,2,2,Multiple Founders
2055,CollegeKhabri,2019,Bhopal,Edtech,Platform is an end-to-end college and career counselling platform for students,Arshi Khan,Vishal Dixit,3000000.0,others,2020,1,1,Multiple Founders
2056,Ola Electric,2018,Bangalore,Transportation,Electric vehicle,"Ankit Jain, Anand Shah",Pawan Munjal Family Trust Fund,1000000.0,others,2020,2,2,Multiple Founders
2057,Multi Living,2018,Mumbai,Real Estate,"It curates apartments from the homeowners, performs the quality check and offers the homes with built-in services to the potential tenants",Pankaj Singh,Lodha Ventures,6000000.0,others,2020,1,1,Multiple Founders
2058,FamPay,2017,Bangalore,Financial Services,"It allows parents to send money to their kids below the age of 18, which they can spend securely under parent supervision.",Kush Taneja,Y Combinator,4700000.0,validation,2020,1,1,Multiple Founders
2059,UnboxRobotics Labs,2017,Bangalore,Transportation,Automated flexible parcel sorting solutions for logistics providers,Pramod Ghadge,Arali Ventures,500000.0,validation,2020,1,1,Multiple Founders
2060,Karbon Card,2016,Bangalore,Financial Services,Specialisde corporate cards for startups,"Pei-fu Hsieh, Amit Jangir",Kunal Shah,2000000.0,validation,2020,2,2,Multiple Founders
2061,Airmeet,2016,Bangalore,Media,"A platform to host, discover, and attend fully remote events like conferences and professional meet-ups","Lalit Mangal, Vinay Jaasti, Manoj Singh",Accel India,3000000.0,others,2020,3,3,Multiple Founders
2062,Innerchef,2015,Gurgaon,Food Industry,Cloud kitchen platform,ajesh,Mistletoe,1000000.0,others,2020,1,1,Multiple Founders
2063,Epigamia,2015,Mumbai,Consumer Goods,Flavoured and greek yoghurt brand,ohan Mirchandani,KA Enterprise,3000000.0,early traction,2020,1,1,Multiple Founders
2064,StyleNook,2015,Mumbai,E-Commerce,Marketplace for fashionable apparel,Lathika Pai,Lead Angels Network,3000000.0,others,2020,1,1,Multiple Founders
2065,Callido Learning,2016,Mumbai,Edtech,Provides a structured educational approach to critical thinking and problem solving skills,Sriram Subramanian,ducation Catalyst Fund,3000000.0,others,2020,1,1,Multiple Founders
2066,Soxytoes,2017,Delhi,E-Commerce,Online store to buy various types of socks including funky and colorful socks,"Vidushi Kajaria, Aayush Goenka",Angel network,3000000.0,others,2020,2,2,Multiple Founders
2067,F5,2018,Delhi,E-Commerce,Retail Aggregator,"aghav Arora, Lalit Kumar Aggarwal",LetsVenture investors,3000000.0,validation,2020,2,2,Multiple Founders
2068,Paper Boat,2013,Bangalore,Food Industry,Ecommerce platform for beverages and snacks,"Neeraj Kakkar, James Nutall, Suhas Misra, Neeraj Biyani",Advent Management,4049500.0,others,2020,4,4,Multiple Founders
2069,Strata,2019,Bangalore,Real Estate,Real estate investment platform,"Sudarshan Lodha, Priyanka Rathore",SAIF Partners,1500000.0,validation,2020,2,2,Multiple Founders
2070,Salesken,2018,Bangalore,AI,Provides sales professionals with intelligence on various aspects of the sales pitch,"Sreeraman Vaidyanathan, Surga Thilakan",Sequoia India,8000000.0,early traction,2020,2,2,Multiple Founders
2071,Arya,2017,Noida,AgriTech,Provides post-harvest services across the agricultural value chain,Prasanna Rao,LGT Lightstone Aspada,6000000.0,early traction,2020,1,1,Multiple Founders
2072,Leap Finance,2016,Bangalore,Financial Services,Provides education loans to students based on the student’s future income,"Vaibhav Singh, Arnav Kumar",Sequoia India,5500000.0,others,2020,2,2,Multiple Founders
2073,Sleepy Owl,2016,Delhi,Beverages,"It sells ready to drink cold brew coffees, brew boxes and packs.","Ajai Thandi, Arman Sood, Ashwajeet Singh",ukam Capital,3000000.0,others,2020,3,3,Multiple Founders
2074,Tricog,2015,Bangalore,HealthTech,Provides virtual cardiology services through its AI-powered healthcare platforms,"Charit Bhograj, Zainul Charbiwala, Udayan Dasgupta, Abhinav Gujjar",UTEC-The University of Tokyo Edge Capital,10500000.0,early traction,2020,4,4,Multiple Founders
2075,GogoBus,2015,Delhi,Travel tech,Inter-City Mobility Startup,Amit Gupta,Ixigo,3000000.0,others,2020,1,1,Multiple Founders
2076,Trell,2016,Bangalore,Media,Allows users to share their travel experiences,"Pulkit Agrawal, Prashant Sachan, Arun Lodhi, Bimal Kartheek Rebba, Nirav Sheth",Sequoia’s Surge,4000000.0,early traction,2020,5,5,Multiple Founders
2077,Spaciya Consultants,2015,Noida,Real Estate,Real estate consultancy firms,Ajit Panda,Alok Garg,500000.0,early traction,2020,1,1,Multiple Founders
2078,Bounce,2014,Bangalore,Transportation,Offers a variety of bikes and scooters that can be rented on a subscription basis,"Vivekananda Hallekere, Anil Giri Raju, Arun Agni",InnoVen Capital,6500000.0,others,2020,3,3,Multiple Founders
2079,Neeman,2017,None,E-Commerce,An eco-conscious footwear brand making comfortable shoes using Merino Wool,"Taran Chhabra, Amar Preet Singh",Anicut Angel Fund,1000000.0,early traction,2020,2,2,Multiple Founders
2080,Chqbook,2017,Gurgaon,Financial Services,"Marketplace for small business owners, offering them products around lending, credit cards etc","Vipul Sharma, Rajat Kumar, Sachin Arora, Mohit Goel",Aavishkaar Capital,5000000.0,early traction,2020,4,4,Multiple Founders
2081,SMEcorner,2014,Mumbai,Financial Services,Financial lending firm to SMEs,"Bhatia, Sneha Shah",Paragon Partners,30000000.0,early traction,2020,2,2,Multiple Founders
2082,Oda Class,2014,Bangalore,Edtech,"It offers content and material via video, adopting a dual-teacher model with IIT and NIT alumni","Li Yong, Shushant Srivastava",Yuanfudao,3000000.0,early traction,2020,2,2,Multiple Founders
2083,Spinny,2015,Haryana,E-Commerce,Used car retailing platform,"Niraj Singh, Mohit Gupta, Ramanshu Mahuar",Nandan Nilekani,43700000.0,early traction,2020,3,3,Multiple Founders
2084,goStops,2012,Delhi,Accomodation,A premium chain of youth hostels catering to the millennials,"Pallavi Agarwal, Pankaj Parwanda",Atraxn Partners.,3000000.0,others,2020,2,2,Multiple Founders
2085,Umeed Housing,2014,Haryana,Financial Services,Housing finance company,Ashutosh Sharma,Morgan Stanley Private Equity Asia,23000000.0,early traction,2020,1,1,Multiple Founders
2086,Vogo,2016,Bangalore,Transportation,A scooter-sharing platform allowing users to rent a two-wheeler from specific designated pick up points,"Anand Ayyadurai, Padmanabhan Balakrishnan, Sanchit Mittal",Lightstone Aspada,20000000.0,early traction,2020,3,3,Multiple Founders
2087,Flick Stree,2016,Mumbai,AI,Artificial intelligence-based video publishing network,Saurabh Singh,Samsung Venture Investment,3000000.0,early traction,2020,1,1,Multiple Founders
2088,Qure ai,2016,Mumbai,HealthTech,Provides interpretations of radiology scans,"Prashant Warier, Pooja Rao",Sequoia India,16000000.0,others,2020,2,2,Multiple Founders
2089,MinionLabs,2015,Bangalore,AI,It leverages a Machine Learning-based approach to generate a comprehensive report on predictive analytics,Gokul Shrinivas,Indian Angel Network,3000000.0,others,2020,1,1,Multiple Founders
2090,Josh Talks,2015,Haryana,Media,Community of young individuals providing a platform to showcase their stories,"Supriya Paul, Shobhit Banga",Media Development Investment Fund,1500000.0,early traction,2020,2,2,Multiple Founders
2091,PhoneParLoan,2015,Delhi,Financial Services,Provides easy loans,ingaile Noq,Accelerator MOX,3000000.0,others,2020,1,1,Multiple Founders
2092,RailYatri,2011,Noida,Travel,A complete Indian railways app,"Manish Rathi, Kapil Raizada, Sachin Saxena",Nandan Nilekani,13800000.0,others,2020,3,3,Multiple Founders
2093,AjnaLens,2014,Thane,InfoTech & Services,"It leverages technologies such as AR, VR & AI to offer hardware in areas such as education and defence","Pankaj Raut, Abhishek Tomar, Abhijit Patil",Maharashtra Defence,1500000.0,early traction,2020,3,3,Multiple Founders
